{
  "$schema": "https://json-schema.org/draft/2020-12/schema",
  "$id": "humanoid.schema.json",
  "title": "Puppetz humanoid recipe",
  "description": "A generated humanoid: body settings plus items in slots. Generated by tools/build-humanoid-schema.mjs; see docs/humanoids.md.",
  "type": "object",
  "required": [
    "generator",
    "id"
  ],
  "additionalProperties": false,
  "properties": {
    "$schema": {
      "type": "string"
    },
    "generator": {
      "const": "humanoid"
    },
    "id": {
      "type": "string",
      "pattern": "^[A-Za-z0-9_-]+$"
    },
    "name": {
      "type": "string"
    },
    "description": {
      "type": "string"
    },
    "version": {
      "type": "integer",
      "minimum": 1
    },
    "body": {
      "type": "object",
      "additionalProperties": false,
      "properties": {
        "sex": {
          "enum": [
            "male",
            "female"
          ],
          "description": "Sex"
        },
        "age": {
          "type": "number",
          "minimum": 5,
          "maximum": 90,
          "description": "Age"
        },
        "height": {
          "type": "number",
          "minimum": 0.8,
          "maximum": 1.2,
          "description": "Height"
        },
        "girth": {
          "type": "number",
          "minimum": 0.8,
          "maximum": 1.35,
          "description": "Girth"
        },
        "skin": {
          "type": "string",
          "pattern": "^#[0-9a-fA-F]{6}$",
          "description": "Skin"
        },
        "eyes": {
          "type": "string",
          "pattern": "^#[0-9a-fA-F]{6}$",
          "description": "Eyes"
        },
        "hairColor": {
          "type": "string",
          "pattern": "^#[0-9a-fA-F]{6}$",
          "description": "Hair color"
        }
      }
    },
    "equipment": {
      "type": "object",
      "additionalProperties": false,
      "properties": {
        "hair": {
          "description": "Hair: short, spiky, bob, long, ponytail, bun, afro, mohawk, braids, pigtails, balding. A name, or { item, color, accent } to recolor it.",
          "oneOf": [
            {
              "enum": [
                "short",
                "spiky",
                "bob",
                "long",
                "ponytail",
                "bun",
                "afro",
                "mohawk",
                "braids",
                "pigtails",
                "balding",
                "none"
              ]
            },
            {
              "type": "object",
              "required": [
                "item"
              ],
              "additionalProperties": false,
              "properties": {
                "item": {
                  "enum": [
                    "short",
                    "spiky",
                    "bob",
                    "long",
                    "ponytail",
                    "bun",
                    "afro",
                    "mohawk",
                    "braids",
                    "pigtails",
                    "balding"
                  ]
                },
                "color": {
                  "type": "string",
                  "pattern": "^#[0-9a-fA-F]{6}$"
                },
                "accent": {
                  "type": "string",
                  "pattern": "^#[0-9a-fA-F]{6}$"
                }
              }
            }
          ]
        },
        "beard": {
          "description": "Beard: shortBeard, longBeard, moustache. A name, or { item, color, accent } to recolor it.",
          "oneOf": [
            {
              "enum": [
                "shortBeard",
                "longBeard",
                "moustache",
                "none"
              ]
            },
            {
              "type": "object",
              "required": [
                "item"
              ],
              "additionalProperties": false,
              "properties": {
                "item": {
                  "enum": [
                    "shortBeard",
                    "longBeard",
                    "moustache"
                  ]
                },
                "color": {
                  "type": "string",
                  "pattern": "^#[0-9a-fA-F]{6}$"
                },
                "accent": {
                  "type": "string",
                  "pattern": "^#[0-9a-fA-F]{6}$"
                }
              }
            }
          ]
        },
        "clothes": {
          "description": "Clothes: shirt, tunic, dress, robe, vest, coat. A name, or { item, color, accent } to recolor it.",
          "oneOf": [
            {
              "enum": [
                "shirt",
                "tunic",
                "dress",
                "robe",
                "vest",
                "coat",
                "none"
              ]
            },
            {
              "type": "object",
              "required": [
                "item"
              ],
              "additionalProperties": false,
              "properties": {
                "item": {
                  "enum": [
                    "shirt",
                    "tunic",
                    "dress",
                    "robe",
                    "vest",
                    "coat"
                  ]
                },
                "color": {
                  "type": "string",
                  "pattern": "^#[0-9a-fA-F]{6}$"
                },
                "accent": {
                  "type": "string",
                  "pattern": "^#[0-9a-fA-F]{6}$"
                }
              }
            }
          ]
        },
        "armor": {
          "description": "Armor: leather, plate, chainmail, breastplate, gambeson. A name, or { item, color, accent } to recolor it.",
          "oneOf": [
            {
              "enum": [
                "leather",
                "plate",
                "chainmail",
                "breastplate",
                "gambeson",
                "none"
              ]
            },
            {
              "type": "object",
              "required": [
                "item"
              ],
              "additionalProperties": false,
              "properties": {
                "item": {
                  "enum": [
                    "leather",
                    "plate",
                    "chainmail",
                    "breastplate",
                    "gambeson"
                  ]
                },
                "color": {
                  "type": "string",
                  "pattern": "^#[0-9a-fA-F]{6}$"
                },
                "accent": {
                  "type": "string",
                  "pattern": "^#[0-9a-fA-F]{6}$"
                }
              }
            }
          ]
        },
        "cape": {
          "description": "Cape: cape, shortCape, cloak, mantle, royalCape. A name, or { item, color, accent } to recolor it.",
          "oneOf": [
            {
              "enum": [
                "cape",
                "shortCape",
                "cloak",
                "mantle",
                "royalCape",
                "none"
              ]
            },
            {
              "type": "object",
              "required": [
                "item"
              ],
              "additionalProperties": false,
              "properties": {
                "item": {
                  "enum": [
                    "cape",
                    "shortCape",
                    "cloak",
                    "mantle",
                    "royalCape"
                  ]
                },
                "color": {
                  "type": "string",
                  "pattern": "^#[0-9a-fA-F]{6}$"
                },
                "accent": {
                  "type": "string",
                  "pattern": "^#[0-9a-fA-F]{6}$"
                }
              }
            }
          ]
        },
        "hands": {
          "description": "Hands: gloves, gauntlets, bracers. A name, or { item, color, accent } to recolor it.",
          "oneOf": [
            {
              "enum": [
                "gloves",
                "gauntlets",
                "bracers",
                "none"
              ]
            },
            {
              "type": "object",
              "required": [
                "item"
              ],
              "additionalProperties": false,
              "properties": {
                "item": {
                  "enum": [
                    "gloves",
                    "gauntlets",
                    "bracers"
                  ]
                },
                "color": {
                  "type": "string",
                  "pattern": "^#[0-9a-fA-F]{6}$"
                },
                "accent": {
                  "type": "string",
                  "pattern": "^#[0-9a-fA-F]{6}$"
                }
              }
            }
          ]
        },
        "feet": {
          "description": "Feet: shoes, boots, greaves, sandals, tallBoots, furBoots. A name, or { item, color, accent } to recolor it.",
          "oneOf": [
            {
              "enum": [
                "shoes",
                "boots",
                "greaves",
                "sandals",
                "tallBoots",
                "furBoots",
                "none"
              ]
            },
            {
              "type": "object",
              "required": [
                "item"
              ],
              "additionalProperties": false,
              "properties": {
                "item": {
                  "enum": [
                    "shoes",
                    "boots",
                    "greaves",
                    "sandals",
                    "tallBoots",
                    "furBoots"
                  ]
                },
                "color": {
                  "type": "string",
                  "pattern": "^#[0-9a-fA-F]{6}$"
                },
                "accent": {
                  "type": "string",
                  "pattern": "^#[0-9a-fA-F]{6}$"
                }
              }
            }
          ]
        },
        "head": {
          "description": "Head: helmet, hood, wizardHat, crown, hornedHelmet, featherHat, bandana, strawHat, circlet. A name, or { item, color, accent } to recolor it.",
          "oneOf": [
            {
              "enum": [
                "helmet",
                "hood",
                "wizardHat",
                "crown",
                "hornedHelmet",
                "featherHat",
                "bandana",
                "strawHat",
                "circlet",
                "none"
              ]
            },
            {
              "type": "object",
              "required": [
                "item"
              ],
              "additionalProperties": false,
              "properties": {
                "item": {
                  "enum": [
                    "helmet",
                    "hood",
                    "wizardHat",
                    "crown",
                    "hornedHelmet",
                    "featherHat",
                    "bandana",
                    "strawHat",
                    "circlet"
                  ]
                },
                "color": {
                  "type": "string",
                  "pattern": "^#[0-9a-fA-F]{6}$"
                },
                "accent": {
                  "type": "string",
                  "pattern": "^#[0-9a-fA-F]{6}$"
                }
              }
            }
          ]
        },
        "back": {
          "description": "Back: backpack, quiver. A name, or { item, color, accent } to recolor it.",
          "oneOf": [
            {
              "enum": [
                "backpack",
                "quiver",
                "none"
              ]
            },
            {
              "type": "object",
              "required": [
                "item"
              ],
              "additionalProperties": false,
              "properties": {
                "item": {
                  "enum": [
                    "backpack",
                    "quiver"
                  ]
                },
                "color": {
                  "type": "string",
                  "pattern": "^#[0-9a-fA-F]{6}$"
                },
                "accent": {
                  "type": "string",
                  "pattern": "^#[0-9a-fA-F]{6}$"
                }
              }
            }
          ]
        },
        "mainHand": {
          "description": "Main hand: sword, axe, spear, staff, dagger, mace, warhammer, torch, wand, bow. A name, or { item, color, accent } to recolor it.",
          "oneOf": [
            {
              "enum": [
                "sword",
                "axe",
                "spear",
                "staff",
                "dagger",
                "mace",
                "warhammer",
                "torch",
                "wand",
                "bow",
                "none"
              ]
            },
            {
              "type": "object",
              "required": [
                "item"
              ],
              "additionalProperties": false,
              "properties": {
                "item": {
                  "enum": [
                    "sword",
                    "axe",
                    "spear",
                    "staff",
                    "dagger",
                    "mace",
                    "warhammer",
                    "torch",
                    "wand",
                    "bow"
                  ]
                },
                "color": {
                  "type": "string",
                  "pattern": "^#[0-9a-fA-F]{6}$"
                },
                "accent": {
                  "type": "string",
                  "pattern": "^#[0-9a-fA-F]{6}$"
                }
              }
            }
          ]
        },
        "offHand": {
          "description": "Off hand: roundShield, kiteShield, buckler, towerShield. A name, or { item, color, accent } to recolor it.",
          "oneOf": [
            {
              "enum": [
                "roundShield",
                "kiteShield",
                "buckler",
                "towerShield",
                "none"
              ]
            },
            {
              "type": "object",
              "required": [
                "item"
              ],
              "additionalProperties": false,
              "properties": {
                "item": {
                  "enum": [
                    "roundShield",
                    "kiteShield",
                    "buckler",
                    "towerShield"
                  ]
                },
                "color": {
                  "type": "string",
                  "pattern": "^#[0-9a-fA-F]{6}$"
                },
                "accent": {
                  "type": "string",
                  "pattern": "^#[0-9a-fA-F]{6}$"
                }
              }
            }
          ]
        }
      }
    },
    "expression": {
      "enum": [
        "neutral",
        "happy",
        "sad",
        "agitated",
        "angry",
        "sleepy"
      ],
      "description": "Expression the character starts with."
    },
    "textures": {
      "type": "boolean",
      "default": true,
      "description": "false: flat colors, no procedural textures."
    },
    "materials": {
      "type": "object",
      "description": "Per-material overrides by material name (skin, clothes, armor_metal, cape...), e.g. a different texture or roughness.",
      "additionalProperties": {
        "type": "object",
        "properties": {
          "color": {
            "type": "string",
            "pattern": "^#[0-9a-fA-F]{6}$"
          },
          "roughness": {
            "type": "number"
          },
          "metalness": {
            "type": "number"
          },
          "texture": {
            "enum": [
              "noise",
              "skin",
              "fabric",
              "knit",
              "leather",
              "metal",
              "wood",
              "hair",
              "chain",
              "fur",
              "quilt"
            ]
          },
          "textureScale": {
            "type": "number"
          },
          "textureStrength": {
            "type": "number"
          },
          "bumpScale": {
            "type": "number"
          }
        }
      }
    }
  }
}
